[
  {
    "extinction_risk_assessment_id": "EXT-001",
    "organism_id": "ORG-001",
    "extinction_probability": 0.115,
    "extinction_probability_period_years": 50,
    "extinction_model": "Synthetic Prototype Model",
    "extinction_probability_confidence": 0.64,
    "risk_indicators": {
      "population_decline": "LOW",
      "population_size": "MODERATE",
      "geographic_range": "MODERATE",
      "habitat_loss": "LOW",
      "fragmentation": "VERY_HIGH",
      "threat_pressure": "VERY_HIGH"
    },
    "gaia_risk_score": 33,
    "risk_level": "Low Risk",
    "risk_confidence": 1.0,
    "score_components": {
      "population_decline": 3.57,
      "population_size": 3.75,
      "habitat_loss": 0.84,
      "range_restriction": 6.84,
      "threat_pressure": 17.8
    },
    "score_weights": {
      "population_decline": 0.3,
      "population_size": 0.15,
      "habitat_loss": 0.2,
      "range_restriction": 0.15,
      "threat_pressure": 0.2
    },
    "explanation": [
      "Population shows a modest decline (11.9% in the synthetic record).",
      "The recorded population is geographically fragmented (severe fragmentation).",
      "Multiple ongoing environmental pressures are present (Agricultural Expansion, Climate Change, Deforestation, Habitat Loss, Hunting)."
    ],
    "disclaimer": "Prototype synthetic estimate produced from synthetic inputs. This is NOT a scientific prediction and must not be read as one. It is not an IUCN category and not an official extinction probability.",
    "is_synthetic": true,
    "source_type": "Calculated",
    "source": "Gaia prototype risk model over synthetic evidence."
  },
  {
    "extinction_risk_assessment_id": "EXT-002",
    "organism_id": "ORG-002",
    "extinction_probability": 0.11,
    "extinction_probability_period_years": 50,
    "extinction_model": "Synthetic Prototype Model",
    "extinction_probability_confidence": 0.42,
    "risk_indicators": {
      "population_decline": "MODERATE",
      "population_size": "MODERATE",
      "geographic_range": "HIGH",
      "habitat_loss": "MODERATE",
      "fragmentation": "MODERATE",
      "threat_pressure": "HIGH"
    },
    "gaia_risk_score": 36,
    "risk_level": "Moderate Risk",
    "risk_confidence": 1.0,
    "score_components": {
      "population_decline": 9.27,
      "population_size": 3.75,
      "habitat_loss": 5.34,
      "range_restriction": 7.62,
      "threat_pressure": 10.0
    },
    "score_weights": {
      "population_decline": 0.3,
      "population_size": 0.15,
      "habitat_loss": 0.2,
      "range_restriction": 0.15,
      "threat_pressure": 0.2
    },
    "explanation": [
      "Population trend indicates sustained decline (30.9% in the synthetic record).",
      "Moderate habitat reduction is recorded (26.7% lost).",
      "Environmental pressure recorded from: Deforestation, Hunting."
    ],
    "disclaimer": "Prototype synthetic estimate produced from synthetic inputs. This is NOT a scientific prediction and must not be read as one. It is not an IUCN category and not an official extinction probability.",
    "is_synthetic": true,
    "source_type": "Calculated",
    "source": "Gaia prototype risk model over synthetic evidence."
  },
  {
    "extinction_risk_assessment_id": "EXT-003",
    "organism_id": "ORG-003",
    "extinction_probability": 0.108,
    "extinction_probability_period_years": 50,
    "extinction_model": "Synthetic Prototype Model",
    "extinction_probability_confidence": 0.53,
    "risk_indicators": {
      "population_decline": "MODERATE",
      "population_size": "MODERATE",
      "geographic_range": "LOW",
      "habitat_loss": "MODERATE",
      "fragmentation": "LOW",
      "threat_pressure": "MODERATE"
    },
    "gaia_risk_score": 33,
    "risk_level": "Low Risk",
    "risk_confidence": 1.0,
    "score_components": {
      "population_decline": 8.61,
      "population_size": 3.75,
      "habitat_loss": 8.9,
      "range_restriction": 3.09,
      "threat_pressure": 9.0
    },
    "score_weights": {
      "population_decline": 0.3,
      "population_size": 0.15,
      "habitat_loss": 0.2,
      "range_restriction": 0.15,
      "threat_pressure": 0.2
    },
    "explanation": [
      "Population trend indicates sustained decline (28.7% in the synthetic record).",
      "Significant habitat reduction is present in the synthetic dataset (44.5% lost).",
      "Environmental pressure recorded from: Pollution."
    ],
    "disclaimer": "Prototype synthetic estimate produced from synthetic inputs. This is NOT a scientific prediction and must not be read as one. It is not an IUCN category and not an official extinction probability.",
    "is_synthetic": true,
    "source_type": "Calculated",
    "source": "Gaia prototype risk model over synthetic evidence."
  },
  {
    "extinction_risk_assessment_id": "EXT-004",
    "organism_id": "ORG-004",
    "extinction_probability": 0.104,
    "extinction_probability_period_years": 50,
    "extinction_model": "Synthetic Prototype Model",
    "extinction_probability_confidence": 0.51,
    "risk_indicators": {
      "population_decline": "LOW",
      "population_size": "MODERATE",
      "geographic_range": "HIGH",
      "habitat_loss": "LOW",
      "fragmentation": "VERY_HIGH",
      "threat_pressure": "LOW"
    },
    "gaia_risk_score": 23,
    "risk_level": "Low Risk",
    "risk_confidence": 1.0,
    "score_components": {
      "population_decline": 3.75,
      "population_size": 3.75,
      "habitat_loss": 3.56,
      "range_restriction": 8.14,
      "threat_pressure": 4.0
    },
    "score_weights": {
      "population_decline": 0.3,
      "population_size": 0.15,
      "habitat_loss": 0.2,
      "range_restriction": 0.15,
      "threat_pressure": 0.2
    },
    "explanation": [
      "Population shows a modest decline (12.5% in the synthetic record).",
      "The recorded population is geographically fragmented (severe fragmentation).",
      "Environmental pressure recorded from: Habitat Loss."
    ],
    "disclaimer": "Prototype synthetic estimate produced from synthetic inputs. This is NOT a scientific prediction and must not be read as one. It is not an IUCN category and not an official extinction probability.",
    "is_synthetic": true,
    "source_type": "Calculated",
    "source": "Gaia prototype risk model over synthetic evidence."
  },
  {
    "extinction_risk_assessment_id": "EXT-005",
    "organism_id": "ORG-005",
    "extinction_probability": 0.121,
    "extinction_probability_period_years": 50,
    "extinction_model": "Synthetic Prototype Model",
    "extinction_probability_confidence": 0.37,
    "risk_indicators": {
      "population_decline": "LOW",
      "population_size": "VERY_HIGH",
      "geographic_range": "HIGH",
      "habitat_loss": "LOW",
      "fragmentation": "HIGH",
      "threat_pressure": "LOW"
    },
    "gaia_risk_score": 30,
    "risk_level": "Low Risk",
    "risk_confidence": 1.0,
    "score_components": {
      "population_decline": 1.5,
      "population_size": 12.75,
      "habitat_loss": 2.12,
      "range_restriction": 9.42,
      "threat_pressure": 4.0
    },
    "score_weights": {
      "population_decline": 0.3,
      "population_size": 0.15,
      "habitat_loss": 0.2,
      "range_restriction": 0.15,
      "threat_pressure": 0.2
    },
    "explanation": [
      "Population appears stable in the synthetic record.",
      "The estimated mature population is very small, which raises risk independently of trend.",
      "The recorded population is geographically fragmented (high fragmentation).",
      "Environmental pressure recorded from: Human Disturbance."
    ],
    "disclaimer": "Prototype synthetic estimate produced from synthetic inputs. This is NOT a scientific prediction and must not be read as one. It is not an IUCN category and not an official extinction probability.",
    "is_synthetic": true,
    "source_type": "Calculated",
    "source": "Gaia prototype risk model over synthetic evidence."
  },
  {
    "extinction_risk_assessment_id": "EXT-006",
    "organism_id": "ORG-006",
    "extinction_probability": 0.518,
    "extinction_probability_period_years": 50,
    "extinction_model": "Synthetic Prototype Model",
    "extinction_probability_confidence": 0.66,
    "risk_indicators": {
      "population_decline": "VERY_HIGH",
      "population_size": "VERY_HIGH",
      "geographic_range": "VERY_HIGH",
      "habitat_loss": "HIGH",
      "fragmentation": "VERY_HIGH",
      "threat_pressure": "VERY_HIGH"
    },
    "gaia_risk_score": 85,
    "risk_level": "Critical Risk",
    "risk_confidence": 1.0,
    "score_components": {
      "population_decline": 22.77,
      "population_size": 15.0,
      "habitat_loss": 12.58,
      "range_restriction": 15.0,
      "threat_pressure": 20.0
    },
    "score_weights": {
      "population_decline": 0.3,
      "population_size": 0.15,
      "habitat_loss": 0.2,
      "range_restriction": 0.15,
      "threat_pressure": 0.2
    },
    "explanation": [
      "Population trend indicates severe decline (75.9% in the synthetic record).",
      "The estimated mature population is very small, which raises risk independently of trend.",
      "Significant habitat reduction is present in the synthetic dataset (62.9% lost).",
      "The recorded population is geographically fragmented (severe fragmentation).",
      "Multiple ongoing environmental pressures are present (Climate Change, Deforestation, Habitat Loss, Human Disturbance, Hunting)."
    ],
    "disclaimer": "Prototype synthetic estimate produced from synthetic inputs. This is NOT a scientific prediction and must not be read as one. It is not an IUCN category and not an official extinction probability.",
    "is_synthetic": true,
    "source_type": "Calculated",
    "source": "Gaia prototype risk model over synthetic evidence."
  },
  {
    "extinction_risk_assessment_id": "EXT-007",
    "organism_id": "ORG-007",
    "extinction_probability": 0.112,
    "extinction_probability_period_years": 50,